id,title,url,publication_date,authors,topics,pdf_path,last_update_date,downloaded_at
IF12826,Ultra-Processed Foods (UPF): Background and Policy Issues,www.congress.gov/crs-report/IF12826,2026-04-21,Laura Pineda-Bermudez; Alexandria K. Mickler,Food Safety; Nutrition Programs & Policies; FDA Product Regulation & Medical Research,pdfs/IF12826.pdf,2026-04-21T16:52:52Z,2026-04-22T07:29:10.806632
IN12516,NIH Indirect Costs Policy for Research Grants: Recent Developments,www.congress.gov/crs-report/IN12516,2026-04-21,Kavya Sekar; Kavya Sekar; Marcy E. Gallo,FDA Product Regulation & Medical Research; R&D Programs & Policies,pdfs/IN12516.pdf,2026-04-21T16:38:18Z,2026-04-22T07:29:11.415797
R48694,Federal Research and Development (R&D) Funding: FY2026,www.congress.gov/crs-report/R48694,2026-04-21,Todd Kuiken; Emily G. Blevins; Laurie Harris; Rachel Lindbergh; Kavya Sekar; Joe Angert; Emily G. Blevins; Marcy E. Gallo,"R&D Programs & Policies; Health & Medical R&D; Commerce, Justice, Science Appropriations; Labor, HHS & Education Appropriations; Energy & Water Development Appropriations; Defense Appropriations",pdfs/R48694.pdf,2026-04-21T16:38:00Z,2026-04-22T07:29:12.067185
IF10973,Craft Alcoholic Beverage Industry: Overview and Regulation,www.congress.gov/crs-report/IF10973,2026-04-21,Anthony A. Cilluffo; Zachary T. Neuhofer; Anthony A. Cilluffo,Food Safety,pdfs/IF10973.pdf,2026-04-21T16:08:00Z,2026-04-22T07:29:12.679568
IF10753,ENERGY STAR Program,www.congress.gov/crs-report/IF10753,2026-04-21,Corrie E. Clark; Corrie E. Clark,Energy Policy,pdfs/IF10753.pdf,2026-04-21T16:07:58Z,2026-04-22T07:29:13.327313
IN12681,Food and Drug Administration (FDA) Response to a Raw Dairy Toxic E. coli Outbreak,www.congress.gov/crs-report/IN12681,2026-04-21,Laura Pineda-Bermudez,,pdfs/IN12681.pdf,2026-04-21T15:53:11Z,2026-04-22T07:29:13.985365
R46646,Election Administration: Federal Grant Programs for States and Localities,www.congress.gov/crs-report/R46646,2026-04-21,Karen L. Shanton,,pdfs/R46646.pdf,2026-04-21T15:53:01Z,2026-04-22T07:29:14.633724
R47263,Ecosystem Restoration in the Infrastructure Investment and Jobs Act: Overview and Issues for Congress,www.congress.gov/crs-report/R47263,2026-04-21,Pervaze A. Sheikh; Laura Gatz; Jonathan L. Ramseur; Anna E. Normand; Eva Lipiec; Lance N. Larson; Megan Stubbs,Water Resource Management; Supplemental Appropriations; Federal Land Management; Wildlife & Ecosystems,pdfs/R47263.pdf,2026-04-21T15:37:56Z,2026-04-22T07:29:15.247225
R46493,U.S. Funding for International Conservation and Biodiversity,www.congress.gov/crs-report/R46493,2026-04-21,Pervaze A. Sheikh; Nick M. Brown; Emily M. Morgenstern,Foreign Assistance; International Natural Resource Issues,pdfs/R46493.pdf,2026-04-21T15:23:39Z,2026-04-22T07:29:15.856310
R43429,Federal Lands and Related Resources: Overview and Selected Issues for the 118th Congress,www.congress.gov/crs-report/R43429,2026-04-21,Laura B. Comay; Caitlin Keating-Bitonti; Mariel J. Murray; Carol Hardy Vincent; Mark K. DeSantis; Eva Lipiec; Anne A. Riddle,Federal Land Management; Wildlife & Ecosystems,pdfs/R43429.pdf,2026-04-21T15:23:15Z,2026-04-22T07:29:16.462275
R46448,Effect of COVID-19 on Federal Land Revenues,www.congress.gov/crs-report/R46448,2026-04-21,Carol Hardy Vincent; Laura B. Comay; Mark K. DeSantis; Eric P. Nardi; Anne A. Riddle,Federal Land Management,pdfs/R46448.pdf,2026-04-21T15:23:10Z,2026-04-22T07:29:17.071562
IF11306,Fire and Deforestation in the Brazilian Amazon,www.congress.gov/crs-report/IF11306,2026-04-21,Peter J. Meyer; Pervaze A. Sheikh; Kezee Procita,,pdfs/IF11306.pdf,2026-04-21T15:23:08Z,2026-04-22T07:29:17.681208
R45696,Forest Management Provisions Enacted in the 115th Congress,www.congress.gov/crs-report/R45696,2026-04-21,Anne A. Riddle; Pervaze A. Sheikh,Federal Land Management,pdfs/R45696.pdf,2026-04-21T15:23:05Z,2026-04-22T07:29:18.300869
RS21880,Wildfire Protection in the WildlandUrban Interface,www.congress.gov/crs-report/RS21880,2026-04-21,Kelsi Bracmort,Federal Land Management; Earth Sciences & Natural Hazards,pdfs/RS21880.pdf,2026-04-21T15:23:03Z,2026-04-22T07:29:18.904887
R44592,Sage-Grouse Conservation: Background and Issues,www.congress.gov/crs-report/R44592,2026-04-21,Pervaze A. Sheikh; Carol Hardy Vincent,Wildlife & Ecosystems; Federal Land Management,pdfs/R44592.pdf,2026-04-21T15:23:01Z,2026-04-22T07:29:19.510493
R43822,Federal Land Management Agencies: Appropriations and Revenues,www.congress.gov/crs-report/R43822,2026-04-21,Carol Hardy Vincent; Laura B. Comay; William J. Mallett,Federal Land Management; Interior & Environment Appropriations,pdfs/R43822.pdf,2026-04-21T15:07:56Z,2026-04-22T07:29:20.137273
LSB11421,ESA “God Squad” Exemption for Gulf Oil and Gas Activities: Background and Current Litigation,www.congress.gov/crs-report/LSB11421,2026-04-21,Cassandra J. Barnum; Erin H. Ward,,pdfs/LSB11421.pdf,2026-04-21T13:53:50Z,2026-04-22T07:29:20.791384
IF13195,Guns and Drugs: A Brief History of 18 U.S.C. § 922(g)(3),www.congress.gov/crs-report/IF13195,2026-04-21,Dave S. Sidhu; Jordan B. Cohen,Crime; Domestic Security; Firearm Background Checks; Firearms & Regulation; Gun Control Act (GCA); Second Amendment; The Supreme Court of the United States; Controlled Substances Act (CSA),pdfs/IF13195.pdf,2026-04-21T12:24:11Z,2026-04-22T07:29:21.399127
IF12501,Private Funding for Election Administration,www.congress.gov/crs-report/IF12501,2026-04-21,Karen L. Shanton,"Voting, Elections & Redistricting",pdfs/IF12501.pdf,2026-04-21T12:09:10Z,2026-04-22T07:29:22.041993
IF13131,NIH Grants Policy Under the Second Trump Administration,www.congress.gov/crs-report/IF13131,2026-04-21,Kavya Sekar,National Institutes of Health (NIH) R&D; FDA Product Regulation & Medical Research; Health & Medical R&D,pdfs/IF13131.pdf,2026-04-21T11:53:45Z,2026-04-22T07:29:22.647440
IF11961,Elections Grant Programs: Authorizations and Appropriations,www.congress.gov/crs-report/IF11961,2026-04-21,Karen L. Shanton,"Voting, Elections & Redistricting",pdfs/IF11961.pdf,2026-04-21T11:38:50Z,2026-04-22T07:29:23.287962
IF11286,Election Security: Federal Funding for Securing Election Systems,www.congress.gov/crs-report/IF11286,2026-04-21,Karen L. Shanton,"Voting, Elections & Redistricting",pdfs/IF11286.pdf,2026-04-21T11:09:02Z,2026-04-22T07:29:23.932985
LSB11420,Congressional Court Watcher: Circuit Splits from March 2026,www.congress.gov/crs-report/LSB11420,2026-04-21,Michael John Garcia; Alexander H. Pepper,,pdfs/LSB11420.pdf,2026-04-21T11:09:01Z,2026-04-22T07:29:24.700220
IF11906,Agriculture in the WTO’s 12th Ministerial Conference (MC12),www.congress.gov/crs-report/IF11906,2026-04-21,Renée Johnson,Agricultural Trade & Food Aid,pdfs/IF11906.pdf,2026-04-21T09:53:38Z,2026-04-22T07:29:25.308138
IF12672,Russia’s Nuclear Weapons,www.congress.gov/crs-report/IF12672,2026-04-20,Anya L. Fink,"Strategic Forces, CBRN, Arms Control & Nonproliferation; Europe, Russia & Eurasia",pdfs/IF12672.pdf,2026-04-22T11:10:03Z,2026-04-22T15:12:11.386704
IF13176,Foreign Agents Registration Act (FARA): Foreign Principal Locations and Activities in the United States,www.congress.gov/crs-report/IF13176,2026-04-20,Jacob R. Straus,Foreign Agents; Foreign Agents Registration Act (FARA); Congressional Ethics & Lobbying,pdfs/IF13176.pdf,2026-04-22T11:10:02Z,2026-04-22T15:12:12.286948
IN12317,Family-to-Family Health Information Centers,www.congress.gov/crs-report/IN12317,2026-04-20,Alexandria K. Mickler; Alexandria K. Mickler,Health Care Delivery; Public Health Services & Special Populations,pdfs/IN12317.pdf,2026-04-22T11:10:00Z,2026-04-22T15:12:13.247342
R48879,Trusts: Income and Estate and Gift Tax Issues,www.congress.gov/crs-report/R48879,2026-04-20,Jane G. Gravelle,Individual Tax; Tax Reform; Estate Tax; Gift Tax,pdfs/R48879.pdf,2026-04-22T11:09:59Z,2026-04-22T15:12:14.188022
IF12135,The U.S. Army’s Typhon Mid-Range Capability (MRC) System,www.congress.gov/crs-report/IF12135,2026-04-20,Andrew Feickert,"Air, Land, Sea, Space & Projection Forces",pdfs/IF12135.pdf,2026-04-22T11:09:54Z,2026-04-22T15:12:15.117832
R48913,Corporate Taxation: The Revenue-Maximizing Tax Rate,www.congress.gov/crs-report/R48913,2026-04-20,Jane G. Gravelle,,pdfs/R48913.pdf,2026-04-22T11:09:52Z,2026-04-22T15:12:15.769735
R47194,"Highway Bridges: Conditions, Funding Programs, and Issues for Congress",www.congress.gov/crs-report/R47194,2026-04-20,William J. Mallett,Highways & Highway Vehicles; Transportation Funding,pdfs/R47194.pdf,2026-04-22T11:09:48Z,2026-04-22T15:12:16.628892
R45741,"Memorials and Commemorative Works Outside Washington, DC: Background, Federal Role, and Options for Congress",www.congress.gov/crs-report/R45741,2026-04-20,Laura B. Comay; Mark K. DeSantis; Jacob R. Straus,Federal Land Management; Commemorations,pdfs/R45741.pdf,2026-04-22T11:09:45Z,2026-04-22T15:12:17.324728
IF13013,Conditioning Federal Funding on Elections Policies: Options and Considerations for Congress,www.congress.gov/crs-report/IF13013,2026-04-20,Karen L. Shanton,"Voting, Elections & Redistricting",pdfs/IF13013.pdf,2026-04-22T11:09:44Z,2026-04-22T15:12:17.964258
IF12155,Farm Bill Primer: Trade and Export Promotion Programs,www.congress.gov/crs-report/IF12155,2026-04-20,Benjamin Tsui,Agricultural Trade & Food Aid; Agricultural Trade,pdfs/IF12155.pdf,2026-04-22T11:09:42Z,2026-04-22T15:12:18.604017
R48469,The Seafood Import Monitoring Program (SIMP),www.congress.gov/crs-report/R48469,2026-04-20,Anthony R. Marshak,Oceans & Fisheries; Agricultural Trade,pdfs/R48469.pdf,2026-04-22T11:09:38Z,2026-04-22T15:12:19.248574
RL34498,"Federal Individual Income Tax Brackets, Standard Deductions, and Personal Exemption: 1988 to 2026",www.congress.gov/crs-report/RL34498,2026-04-20,Nicholas E. Buffie; Brendan McDermott,,pdfs/RL34498.pdf,2026-04-22T11:09:01Z,2026-04-22T15:12:19.906690
LSB11405,Education Department’s DEI Certification Requirement for Schools: Overview and Legal Challenges,www.congress.gov/crs-report/LSB11405,2026-04-20,Jared P. Cole; Madeline W. Donley,Equal Protection; K-12 Education; Civil Rights & Liberties; Elementary & Secondary Education; Jurisprudence,pdfs/LSB11405.pdf,2026-04-22T11:09:00Z,2026-04-22T15:12:20.773774
IN12669,Pentagon-Anthropic Dispute over Autonomous Weapon Systems: Potential Issues for Congress,www.congress.gov/crs-report/IN12669,2026-04-20,Kelley M. Sayler,"Technology, Information & Cyber Defense; Defense Acquisitions",pdfs/IN12669.pdf,2026-04-22T11:08:59Z,2026-04-22T15:12:21.415262
LSB11403,International Agreements and Non-binding Instruments: The Case-Zablocki Act (Case Act),www.congress.gov/crs-report/LSB11403,2026-04-20,Karen Sokol,Executive Branch; Foreign Policy Institutions & Tools; International Law; Separation of Powers,pdfs/LSB11403.pdf,2026-04-22T11:08:58Z,2026-04-22T15:12:22.306137
IN12664,Executive Office for Immigration Review Immigration Judge Staffing Issues,www.congress.gov/crs-report/IN12664,2026-04-20,Holly Straut-Eppsteiner,"Immigration Enforcement & Removal; Asylees, Refugees & Other Humanitarian Concerns; Immigration Law; Executive Office for Immigration Review (EOIR)",pdfs/IN12664.pdf,2026-04-22T11:08:58Z,2026-04-22T15:12:23.204529
R44243,Electing the Speaker of the House of Representatives: Frequently Asked Questions,www.congress.gov/crs-report/R44243,2026-04-20,Valerie Heitshusen,Congressional Leadership; Congressional Operations,pdfs/R44243.pdf,2026-04-22T11:08:55Z,2026-04-22T15:12:23.851200
IF11962,Establishing and Funding Elections Grant Programs: Policy Options,www.congress.gov/crs-report/IF11962,2026-04-20,Karen L. Shanton,"Voting, Elections & Redistricting",pdfs/IF11962.pdf,2026-04-22T11:08:53Z,2026-04-22T15:12:24.498437
IF11755,The Marine Corps’ Amphibious Combat Vehicle (ACV),www.congress.gov/crs-report/IF11755,2026-04-20,Andrew Feickert,"Air, Land, Sea, Space & Projection Forces",pdfs/IF11755.pdf,2026-04-22T11:08:50Z,2026-04-22T15:12:25.361562
LSB11422,Parental Rights and Student Gender Transitions at School: Legal Developments,www.congress.gov/crs-report/LSB11422,2026-04-20,Jared P. Cole; Whitney K. Novak,Civil Rights & Liberties; Due Process Clause; Family Education Rights & Privacy Act (FERPA); First Amendment; Free Exercise Clause; Jurisprudence; Privacy; School & Campus Safety,pdfs/LSB11422.pdf,2026-04-22T11:08:49Z,2026-04-22T15:12:26.271613
IF13206,Judiciary Budget Request for FY2027,www.congress.gov/crs-report/IF13206,2026-04-20,Barry J. McMillion,,pdfs/IF13206.pdf,2026-04-22T11:08:48Z,2026-04-22T15:12:26.932684
R48912,Child Welfare Funding in the President’s FY2027 Budget: In Brief,www.congress.gov/crs-report/R48912,2026-04-20,Emilie Stoltzfus,"Child Welfare; Labor, HHS & Education Appropriations",pdfs/R48912.pdf,2026-04-22T11:08:48Z,2026-04-22T15:12:27.593816
R48883,An Overview of Decentralized Finance (Defi),www.congress.gov/crs-report/R48883,2026-04-20,Paul Tierno,Banking; Blockchain & Cryptocurrencies; Digital & Virtual Currencies; Financial Technology Innovation; Stablecoins,pdfs/R48883.pdf,2026-04-22T08:52:54Z,2026-04-22T15:12:28.245428
R45741,"Memorials and Commemorative Works Outside Washington, DC: Background, Federal Role, and Options for Congress",www.congress.gov/crs-report/R45741,2026-04-23,Laura B. Comay; Mark K. DeSantis; Jacob R. Straus,Federal Land Management; Commemorations,pdfs/R45741.pdf,2026-04-23T17:07:55Z,2026-04-24T08:57:26.727185
R48179,Tickets for Live Entertainment Events,www.congress.gov/crs-report/R48179,2026-04-23,Clare Y. Cho,Competition Policy & Law; Service Sectors,pdfs/R48179.pdf,2026-04-23T16:37:50Z,2026-04-24T08:57:27.479945
R48913,Corporate Taxation: The Revenue-Maximizing Tax Rate,www.congress.gov/crs-report/R48913,2026-04-23,Jane G. Gravelle,,pdfs/R48913.pdf,2026-04-23T15:23:00Z,2026-04-24T08:57:28.380107
IF12094,The Army’s XM-30 Mechanized Infantry Combat Vehicle (Formerly the Optionally Manned Fighting Vehicle [OMFV]),www.congress.gov/crs-report/IF12094,2026-04-23,Andrew Feickert; Ebrima M'Bai,"Air, Land, Sea, Space & Projection Forces",pdfs/IF12094.pdf,2026-04-23T13:53:05Z,2026-04-24T08:57:29.546215
R47277,Reserve Funds in the Congressional Budget Process: Frequently Asked Questions,www.congress.gov/crs-report/R47277,2026-04-23,Megan S. Lynch,Budget & Appropriations Procedure,pdfs/R47277.pdf,2026-04-23T13:53:03Z,2026-04-24T08:57:30.514193
R44243,Electing the Speaker of the House of Representatives: Frequently Asked Questions,www.congress.gov/crs-report/R44243,2026-04-23,Valerie Heitshusen,Congressional Operations; Congressional Leadership,pdfs/R44243.pdf,2026-04-23T12:22:58Z,2026-04-24T08:57:31.686506
IF12155,Farm Bill Primer: Trade and Export Promotion Programs,www.congress.gov/crs-report/IF12155,2026-04-23,Benjamin Tsui,Agricultural Trade & Food Aid; Agricultural Trade,pdfs/IF12155.pdf,2026-04-23T12:08:00Z,2026-04-24T08:57:33.179502
R48912,Child Welfare Funding in the President’s FY2027 Budget: In Brief,www.congress.gov/crs-report/R48912,2026-04-23,Emilie Stoltzfus,"Child Welfare; Labor, HHS & Education Appropriations",pdfs/R48912.pdf,2026-04-23T12:07:59Z,2026-04-24T08:57:34.130646
IF13207,Prediction Markets Legislation in the 119th Congress,www.congress.gov/crs-report/IF13207,2026-04-23,Karl E. Schneider; Alexander H. Pepper,,pdfs/IF13207.pdf,2026-04-23T11:07:52Z,2026-04-24T08:57:35.098260
IF10753,ENERGY STAR Program,www.congress.gov/crs-report/IF10753,2026-04-24,Corrie E. Clark; Corrie E. Clark,Energy Policy,pdfs/IF10753.pdf,2026-04-24T14:40:20Z,2026-04-25T08:02:34.788905
R48302,Critical Minerals on the U.S. Outer Continental Shelf: The Bureau of Ocean Energy Management’s Role and Issues for Congress,www.congress.gov/crs-report/R48302,2026-04-24,Laura B. Comay; Caitlin Keating-Bitonti,Federal Land Management; Natural Resources Policy; Federal Agencies & Appropriations for Energy & Natural Resources; Oceans & Fisheries; Energy Policy,pdfs/R48302.pdf,2026-04-24T14:40:11Z,2026-04-25T08:02:35.746724
R48728,"Transportation, Housing and Urban Development, and Related Agencies (THUD) Appropriations for FY2026",www.congress.gov/crs-report/R48728,2026-04-24,Jennifer J. Marshall; Maggie McCarty,Transportation & HUD Appropriations; Transportation Funding; Housing Budget & Appropriations,pdfs/R48728.pdf,2026-04-24T14:39:59Z,2026-04-25T08:02:36.695871
RL34498,"Federal Individual Income Tax Brackets, Standard Deductions, and Personal Exemption: 1988 to 2026",www.congress.gov/crs-report/RL34498,2026-04-24,Nicholas E. Buffie; Brendan McDermott,,pdfs/RL34498.pdf,2026-04-24T14:39:10Z,2026-04-25T08:02:37.398050
IN12279,Growth in Electric Vehicle Manufacturing: A Factor in the 2023 United Auto Workers (UAW) Negotiations,www.congress.gov/crs-report/IN12279,2026-04-24,Steven H. Bayless,Labor Relations; Highways & Highway Vehicles,pdfs/IN12279.pdf,2026-04-24T14:39:10Z,2026-04-25T08:02:38.692923
IF12526,Cement: Background and Low-Carbon Production,www.congress.gov/crs-report/IF12526,2026-04-24,Christopher D. Watson,Technology & Innovation; Climate Change; Manufacturing Policy,pdfs/IF12526.pdf,2026-04-24T14:39:09Z,2026-04-25T08:02:39.818437
IF12363,Import Monitoring Systems: Steel and Aluminum,www.congress.gov/crs-report/IF12363,2026-04-24,Christopher D. Watson,Manufacturing Policy; Import Policy,pdfs/IF12363.pdf,2026-04-24T14:39:08Z,2026-04-25T08:02:40.596229
R46552,Safety Impact of Speed and Red Light Cameras,www.congress.gov/crs-report/R46552,2026-04-24,David Randall Peterman,Transportation Safety,pdfs/R46552.pdf,2026-04-24T14:38:51Z,2026-04-25T08:02:41.302472
R44394,Federal Highway Traffic Safety Policies: Impacts and Opportunities,www.congress.gov/crs-report/R44394,2026-04-24,David Randall Peterman,Transportation Safety,pdfs/R44394.pdf,2026-04-24T14:38:45Z,2026-04-25T08:02:41.977283
R46276,The Hours of Service (HOS) Rule for Commercial Truck Drivers and the Electronic Logging Device (ELD) Mandate,www.congress.gov/crs-report/R46276,2026-04-24,David Randall Peterman,Freight; Transportation Safety,pdfs/R46276.pdf,2026-04-24T14:38:43Z,2026-04-25T08:02:42.623160
R45916,The TIGER/BUILD Program at 10 Years: An Overview,www.congress.gov/crs-report/R45916,2026-04-24,David Randall Peterman,Transportation Funding,pdfs/R45916.pdf,2026-04-24T14:38:42Z,2026-04-25T08:02:43.306475
R45727,The Highway Funding Formula: History and Current Status,www.congress.gov/crs-report/R45727,2026-04-24,Robert S. Kirk,Highways & Highway Vehicles; Transportation Funding,pdfs/R45727.pdf,2026-04-24T14:38:41Z,2026-04-25T08:02:44.003063
IF10941,Buy America and the Electric Bus Market,www.congress.gov/crs-report/IF10941,2026-04-24,William J. Mallett,Transportation Infrastructure & Vehicles; Manufacturing Policy; Public Transit & Passenger Rail,pdfs/IF10941.pdf,2026-04-24T14:38:40Z,2026-04-25T08:02:44.760487
IF10728,After the Storm: Highway Reconstruction and Resilience,www.congress.gov/crs-report/IF10728,2026-04-24,Robert S. Kirk,Highways & Highway Vehicles; Federal Disasters & Assistance,pdfs/IF10728.pdf,2026-04-24T14:38:40Z,2026-04-25T08:02:45.539852
R41869,The Donor-Donee State Issue in Highway Finance,www.congress.gov/crs-report/R41869,2026-04-24,Robert S. Kirk,,pdfs/R41869.pdf,2026-04-24T14:38:36Z,2026-04-25T08:02:46.222526
R42584,The Development of High Speed Rail in the United States: Issues and Recent Events,www.congress.gov/crs-report/R42584,2026-04-24,William J. Mallett; John Frittelli,Public Transit & Passenger Rail,pdfs/R42584.pdf,2026-04-24T14:38:32Z,2026-04-25T08:02:47.139343
R43042,Ensuring That Traffic Signs Are Visible at Night: Federal Regulations,www.congress.gov/crs-report/R43042,2026-04-24,David Randall Peterman,,pdfs/R43042.pdf,2026-04-24T14:38:32Z,2026-04-25T08:02:48.038268
RL33286,The Federal Railroad Administration’s Train Horn Rule,www.congress.gov/crs-report/RL33286,2026-04-24,David Randall Peterman,,pdfs/RL33286.pdf,2026-04-24T14:38:29Z,2026-04-25T08:02:48.725707
R45500,Transportation Security: Issues for the 116th Congress,www.congress.gov/crs-report/R45500,2026-04-24,John Frittelli; Bart Elias,Transportation Security,pdfs/R45500.pdf,2026-04-24T14:38:26Z,2026-04-25T08:02:49.400029
R41978,The Role of TARP Assistance in the Restructuring of General Motors,www.congress.gov/crs-report/R41978,2026-04-24,Baird Webel,Manufacturing Policy,pdfs/R41978.pdf,2026-04-24T14:38:21Z,2026-04-25T08:02:50.096315
R43651,“Black Boxes” in Passenger Vehicles: Policy Issues,www.congress.gov/crs-report/R43651,2026-04-24,David Randall Peterman,Transportation Safety,pdfs/R43651.pdf,2026-04-24T14:38:17Z,2026-04-25T08:02:51.503327
R41846,Government Assistance for GMAC/Ally Financial: Unwinding the Government Stake,www.congress.gov/crs-report/R41846,2026-04-24,Baird Webel,,pdfs/R41846.pdf,2026-04-24T14:38:12Z,2026-04-25T08:02:53.020778
R44388,Surface Transportation Funding and Programs Under the Fixing America’s Surface Transportation Act (FAST Act; P.L. 114-94),www.congress.gov/crs-report/R44388,2026-04-24,John Frittelli; William J. Mallett,Transportation Funding,pdfs/R44388.pdf,2026-04-24T14:38:09Z,2026-04-25T08:02:53.845431
R44654,The High-Speed Intercity Passenger Rail (HSIPR) Grant Program: Overview,www.congress.gov/crs-report/R44654,2026-04-24,David Randall Peterman,Public Transit & Passenger Rail,pdfs/R44654.pdf,2026-04-24T14:38:08Z,2026-04-25T08:02:54.652650
R44973,Amtrak: Overview,www.congress.gov/crs-report/R44973,2026-04-24,David Randall Peterman,Public Transit & Passenger Rail,pdfs/R44973.pdf,2026-04-24T14:38:04Z,2026-04-25T08:02:55.304651
R46312,Forest Carbon Primer,www.congress.gov/crs-report/R46312,2026-04-24,Anne A. Riddle,Wildlife & Ecosystems; Climate Change,pdfs/R46312.pdf,2026-04-24T14:09:04Z,2026-04-25T08:02:56.006817
IF12001,U.S. Forest Ownership and Management,www.congress.gov/crs-report/IF12001,2026-04-24,Anne A. Riddle,Federal Land Management,pdfs/IF12001.pdf,2026-04-24T13:54:20Z,2026-04-25T08:02:56.887894
R46313,U.S. Forest Carbon Data: In Brief,www.congress.gov/crs-report/R46313,2026-04-24,Anne A. Riddle,Wildlife & Ecosystems; Climate Change,pdfs/R46313.pdf,2026-04-24T13:54:15Z,2026-04-25T08:02:57.742686
R47201,Legal and Practical Implications of the Ninth Circuit’s Cottonwood Environmental Law Center v. U.S. Forest Service Decision Under the Endangered Species Act,www.congress.gov/crs-report/R47201,2026-04-24,Erin H. Ward; Pervaze A. Sheikh,Wildlife & Ecosystems; Federal Land Management,pdfs/R47201.pdf,2026-04-24T13:54:12Z,2026-04-25T08:02:58.434983
R45994,Federal Land Management Agencies’ Mandatory Appropriations Accounts,www.congress.gov/crs-report/R45994,2026-04-24,Carol Hardy Vincent; Laura B. Comay,Federal Land Management; Interior & Environment Appropriations,pdfs/R45994.pdf,2026-04-24T13:54:08Z,2026-04-25T08:02:59.102953
R45340,Federal Land Designations: A Brief Guide,www.congress.gov/crs-report/R45340,2026-04-24,Laura B. Comay; Carol Hardy Vincent; Mark K. DeSantis; Anne A. Riddle,,pdfs/R45340.pdf,2026-04-24T13:38:54Z,2026-04-25T08:02:59.782372
R46952,Reduction in Emissions from Deforestation and Forest Degradation (REDD+),www.congress.gov/crs-report/R46952,2026-04-24,Pervaze A. Sheikh; Kezee Procita; Anne A. Riddle,International Natural Resource Issues,pdfs/R46952.pdf,2026-04-24T13:38:53Z,2026-04-25T08:03:00.525436
R48725,Social Security Administration (SSA) Staffing Levels: Data Brief,www.congress.gov/crs-report/R48725,2026-04-24,William R. Morton,Social Security Administration (SSA); Social Security; Federal Workforce Management; Labor Force Data,pdfs/R48725.pdf,2026-04-24T13:38:50Z,2026-04-25T08:03:01.186885
R47666,"Infrastructure Codes, Standards, and Regulations: Frequently Asked Questions",www.congress.gov/crs-report/R47666,2026-04-24,Linda R. Rowan; Nicole T. Carter; Corrie E. Clark; John Frittelli; Jill C. Gallagher; Diane P. Horn; Elena H. Humphreys; Ashley J. Lawson; William J. Mallett; Anna E. Normand; Paul W. Parfomak; Jonathan L. Ramseur; Rachel Y. Tang,Earth Sciences & Natural Hazards,pdfs/R47666.pdf,2026-04-24T13:24:03Z,2026-04-25T08:03:01.874990
RS22331,Foreign Holdings of Federal Debt,www.congress.gov/crs-report/RS22331,2026-04-24,Marc Labonte; Ben Leubsdorf,,pdfs/RS22331.pdf,2026-04-24T13:09:01Z,2026-04-25T08:03:02.558366
IN12674,Private Credit Funds Redemption Restrictions: Market Context and Policy Issues,www.congress.gov/crs-report/IN12674,2026-04-24,Eva Su,Financial Technology Innovation; Financial Market Regulation; Financial Stability; Securities,pdfs/IN12674.pdf,2026-04-24T12:53:54Z,2026-04-25T08:03:03.395364
R48914,Cryptocurrency Mining and the Electricity Sector,www.congress.gov/crs-report/R48914,2026-04-24,Corrie E. Clark,Electricity; Energy Policy,pdfs/R48914.pdf,2026-04-24T12:53:53Z,2026-04-25T08:03:04.085336
R48906,Inflation Reduction Act Methane Emissions Charge: Overview and Considerations for Policymakers,www.congress.gov/crs-report/R48906,2026-04-24,Jonathan L. Ramseur,Climate Change,pdfs/R48906.pdf,2026-04-24T11:53:46Z,2026-04-25T08:03:04.810101
R48915,"Preemption and the Federal Food, Drug, and Cosmetic Act (FD&C Act)",www.congress.gov/crs-report/R48915,2026-04-24,Wen W. Shen; Dorothy C. Kafka,"Federal Preemption; Federal Food, Drug & Cosmetic Act (FFDCA)",pdfs/R48915.pdf,2026-04-24T11:09:05Z,2026-04-25T08:03:05.555441
R47645,U.S. Regional Fishery Management Councils,www.congress.gov/crs-report/R47645,2026-04-24,Anthony R. Marshak,Wildlife & Ecosystems; Oceans & Fisheries; Natural Resources Policy,pdfs/R47645.pdf,2026-04-24T10:53:53Z,2026-04-25T08:03:06.478764
IF12495,The Army’s M-1E3 Abrams Tank Modernization Program,www.congress.gov/crs-report/IF12495,2026-04-24,Ebrima M'Bai; Andrew Feickert,"Air, Land, Sea, Space & Projection Forces",pdfs/IF12495.pdf,2026-04-24T10:38:58Z,2026-04-25T08:03:07.429486
IF13178,NHTSA’s Authorities and Rulemaking Process,www.congress.gov/crs-report/IF13178,2026-04-24,Naseeb A. Souweidane,National Highway Traffic Safety Administration (NHTSA); Transportation Safety,pdfs/IF13178.pdf,2026-04-24T10:08:53Z,2026-04-25T08:03:08.232991
